"","book","chapter","verse","text"
"1039","Genesis","35","26","The sons of Leah’s servant Zilpah: Gad and Asher. These were the sons of Jacob, who were born to him in Paddan Aram. "
"1040","Genesis","35","27","Jacob came home to his father Isaac in Mamre, near Kiriath Arba (that is, Hebron), where Abraham and Isaac had stayed.  "
"1041","Genesis","35","28","Isaac lived a hundred and eighty years.  "
"1042","Genesis","35","29","Then he breathed his last and died and was gathered to his people, old and full of years. And his sons Esau and Jacob buried him."
"1043","Genesis","36","1","This is the account of the family line of Esau (that is, Edom). "
"1044","Genesis","36","2","Esau took his wives from the women of Canaan: Adah daughter of Elon the Hittite, and Oholibamah daughter of Anah and granddaughter of Zibeon the Hivite—  "
"1045","Genesis","36","3","also Basemath daughter of Ishmael and sister of Nebaioth. "
"1046","Genesis","36","4","Adah bore Eliphaz to Esau, Basemath bore Reuel,  "
"1047","Genesis","36","5","and Oholibamah bore Jeush, Jalam and Korah. These were the sons of Esau, who were born to him in Canaan. "
"1048","Genesis","36","6","Esau took his wives and sons and daughters and all the members of his household, as well as his livestock and all his other animals and all the goods he had acquired in Canaan, and moved to a land some distance from his brother Jacob.  "
"1049","Genesis","36","7","Their possessions were too great for them to remain together; the land where they were staying could not support them both because of their livestock.  "
"1050","Genesis","36","8","So Esau (that is, Edom) settled in the hill country of Seir. "
"1051","Genesis","36","9","This is the account of the family line of Esau the father of the Edomites in the hill country of Seir. "
"1052","Genesis","36","10","These are the names of Esau’s sons: Eliphaz, the son of Esau’s wife Adah, and Reuel, the son of Esau’s wife Basemath. "
"1053","Genesis","36","11","The sons of Eliphaz: Teman, Omar, Zepho, Gatam and Kenaz. "
"1054","Genesis","36","12","Esau’s son Eliphaz also had a concubine named Timna, who bore him Amalek. These were grandsons of Esau’s wife Adah. "
"1055","Genesis","36","13","The sons of Reuel: Nahath, Zerah, Shammah and Mizzah. These were grandsons of Esau’s wife Basemath. "
"1056","Genesis","36","14","Jeush, Jalam and Korah. "
"1057","Genesis","36","15","These were the chiefs among Esau’s descendants: The sons of Eliphaz the firstborn of Esau: Chiefs Teman, Omar, Zepho, Kenaz,  "
"1058","Genesis","36","16","Korah,  Gatam and Amalek. These were the chiefs descended from Eliphaz in Edom; they were grandsons of Adah. "
"1059","Genesis","36","17","The sons of Esau’s son Reuel: Chiefs Nahath, Zerah, Shammah and Mizzah. These were the chiefs descended from Reuel in Edom; they were grandsons of Esau’s wife Basemath. "
"1060","Genesis","36","18","The sons of Esau’s wife Oholibamah: Chiefs Jeush, Jalam and Korah. These were the chiefs descended from Esau’s wife Oholibamah daughter of Anah. "
"1061","Genesis","36","19","These were the sons of Esau (that is, Edom), and these were their chiefs. "
"1062","Genesis","36","20","These were the sons of Seir the Horite, who were living in the region: Lotan, Shobal, Zibeon, Anah,  "
"1063","Genesis","36","21","Dishon, Ezer and Dishan. These sons of Seir in Edom were Horite chiefs. "
"1064","Genesis","36","22","The sons of Lotan: Hori and Homam.  Timna was Lotan’s sister. "
"1065","Genesis","36","23","The sons of Shobal: Alvan, Manahath, Ebal, Shepho and Onam. "
"1066","Genesis","36","24","The sons of Zibeon: Aiah and Anah. This is the Anah who discovered the hot springs  in the desert while he was grazing the donkeys of his father Zibeon. "
"1067","Genesis","36","25","The children of Anah: Dishon and Oholibamah daughter of Anah. "
"1068","Genesis","36","26","The sons of Dishon : Hemdan, Eshban, Ithran and Keran. "
"1069","Genesis","36","27","The sons of Ezer: Bilhan, Zaavan and Akan. "
"1070","Genesis","36","28","The sons of Dishan: Uz and Aran. "
"1071","Genesis","36","29","These were the Horite chiefs: Lotan, Shobal, Zibeon, Anah,  "
"1072","Genesis","36","30","Dishon, Ezer and Dishan. These were the Horite chiefs, according to their divisions, in the land of Seir. "
"1073","Genesis","36","31","These were the kings who reigned in Edom before any Israelite king reigned: "
"1074","Genesis","36","32","Bela son of Beor became king of Edom. His city was named Dinhabah. "
"1075","Genesis","36","33","When Bela died, Jobab son of Zerah from Bozrah succeeded him as king. "
"1076","Genesis","36","34","When Jobab died, Husham from the land of the Temanites succeeded him as king. "
"1077","Genesis","36","35","When Husham died, Hadad son of Bedad, who defeated Midian in the country of Moab, succeeded him as king. His city was named Avith. "
"1078","Genesis","36","36","When Hadad died, Samlah from Masrekah succeeded him as king. "
"1079","Genesis","36","37","When Samlah died, Shaul from Rehoboth on the river succeeded him as king. "
"1080","Genesis","36","38","When Shaul died, Baal-Hanan son of Akbor succeeded him as king. "
"1081","Genesis","36","39","When Baal-Hanan son of Akbor died, Hadad  succeeded him as king. His city was named Pau, and his wife’s name was Mehetabel daughter of Matred, the daughter of Me-Zahab. "
"1082","Genesis","36","40","These were the chiefs descended from Esau, by name, according to their clans and regions: Timna, Alvah, Jetheth,  "
"1083","Genesis","36","41","Oholibamah, Elah, Pinon,  "
"1084","Genesis","36","42","Kenaz, Teman, Mibzar,  "
"1085","Genesis","36","43","Magdiel and Iram. These were the chiefs of Edom, according to their settlements in the land they occupied. This is the family line of Esau, the father of the Edomites."
"1086","Genesis","37","1","Jacob lived in the land where his father had stayed, the land of Canaan. "
"1087","Genesis","37","2","This is the account of Jacob’s family line. Joseph, a young man of seventeen, was tending the flocks with his brothers, the sons of Bilhah and the sons of Zilpah, his father’s wives, and he brought their father a bad report about them. "
"1088","Genesis","37","3","Now Israel loved Joseph more than any of his other sons, because he had been born to him in his old age; and he made an ornate  robe for him.  "
"1089","Genesis","37","4","When his brothers saw that their father loved him more than any of them, they hated him and could not speak a kind word to him. "
"1090","Genesis","37","5","Joseph had a dream, and when he told it to his brothers, they hated him all the more.  "
"1091","Genesis","37","6","He said to them, “Listen to this dream I had:  "
"1092","Genesis","37","7","We were binding sheaves of grain out in the field when suddenly my sheaf rose and stood upright, while your sheaves gathered around mine and bowed down to it.” "
"1093","Genesis","37","8","His brothers said to him, “Do you intend to reign over us? Will you actually rule us?” And they hated him all the more because of his dream and what he had said. "
"1094","Genesis","37","9","Then he had another dream, and he told it to his brothers. “Listen,” he said, “I had another dream, and this time the sun and moon and eleven stars were bowing down to me.” "
"1095","Genesis","37","10","When he told his father as well as his brothers, his father rebuked him and said, “What is this dream you had? Will your mother and I and your brothers actually come and bow down to the ground before you?”  "
"1096","Genesis","37","11","His brothers were jealous of him, but his father kept the matter in mind. "
"1097","Genesis","37","12","Now his brothers had gone to graze their father’s flocks near Shechem,  "
"1098","Genesis","37","13","and Israel said to Joseph, “As you know, your brothers are grazing the flocks near Shechem. Come, I am going to send you to them.” “Very well,” he replied. "
"1099","Genesis","37","14","So he said to him, “Go and see if all is well with your brothers and with the flocks, and bring word back to me.” Then he sent him off from the Valley of Hebron. When Joseph arrived at Shechem,  "
"1100","Genesis","37","15","a man found him wandering around in the fields and asked him, “What are you looking for?” "
"1101","Genesis","37","16","He replied, “I’m looking for my brothers. Can you tell me where they are grazing their flocks?” "
"1102","Genesis","37","17","“They have moved on from here,” the man answered. “I heard them say, ‘Let’s go to Dothan.’ ” So Joseph went after his brothers and found them near Dothan.  "
"1103","Genesis","37","18","But they saw him in the distance, and before he reached them, they plotted to kill him. "
"1104","Genesis","37","19","“Here comes that dreamer!” they said to each other.  "
"1105","Genesis","37","20","“Come now, let’s kill him and throw him into one of these cisterns and say that a ferocious animal devoured him. Then we’ll see what comes of his dreams.” "
"1106","Genesis","37","21","When Reuben heard this, he tried to rescue him from their hands. “Let’s not take his life,” he said.  "
"1107","Genesis","37","22","“Don’t shed any blood. Throw him into this cistern here in the wilderness, but don’t lay a hand on him.” Reuben said this to rescue him from them and take him back to his father. "
"1108","Genesis","37","23","So when Joseph came to his brothers, they stripped him of his robe—the ornate robe he was wearing—  "
"1109","Genesis","37","24","and they took him and threw him into the cistern. The cistern was empty; there was no water in it. "
"1110","Genesis","37","25","As they sat down to eat their meal, they looked up and saw a caravan of Ishmaelites coming from Gilead. Their camels were loaded with spices, balm and myrrh, and they were on their way to take them down to Egypt. "
"1111","Genesis","37","26","Judah said to his brothers, “What will we gain if we kill our brother and cover up his blood?  "
"1112","Genesis","37","27","Come, let’s sell him to the Ishmaelites and not lay our hands on him; after all, he is our brother, our own flesh and blood.” His brothers agreed. "
"1113","Genesis","37","28","So when the Midianite merchants came by, his brothers pulled Joseph up out of the cistern and sold him for twenty shekels  of silver to the Ishmaelites, who took him to Egypt. "
"1114","Genesis","37","29","When Reuben returned to the cistern and saw that Joseph was not there, he tore his clothes.  "
"1115","Genesis","37","30","He went back to his brothers and said, “The boy isn’t there! Where can I turn now?” "
"1116","Genesis","37","31","Then they got Joseph’s robe, slaughtered a goat and dipped the robe in the blood.  "
"1117","Genesis","37","32","They took the ornate robe back to their father and said, “We found this. Examine it to see whether it is your son’s robe.” "
"1118","Genesis","37","33","He recognized it and said, “It is my son’s robe! Some ferocious animal has devoured him. Joseph has surely been torn to pieces.” "
"1119","Genesis","37","34","Then Jacob tore his clothes, put on sackcloth and mourned for his son many days.  "
"1120","Genesis","37","35","All his sons and daughters came to comfort him, but he refused to be comforted. “No,” he said, “I will continue to mourn until I join my son in the grave.” So his father wept for him. "
"1121","Genesis","37","36","Meanwhile, the Midianites  sold Joseph in Egypt to Potiphar, one of Pharaoh’s officials, the captain of the guard."
"1122","Genesis","38","1","At that time, Judah left his brothers and went down to stay with a man of Adullam named Hirah.  "
"1123","Genesis","38","2","There Judah met the daughter of a Canaanite man named Shua. He married her and made love to her;  "
"1124","Genesis","38","3","she became pregnant and gave birth to a son, who was named Er.  "
"1125","Genesis","38","4","She conceived again and gave birth to a son and named him Onan.  "
"1126","Genesis","38","5","She gave birth to still another son and named him Shelah. It was at Kezib that she gave birth to him. "
"1127","Genesis","38","6","Judah got a wife for Er, his firstborn, and her name was Tamar.  "
"1128","Genesis","38","7","But Er, Judah’s firstborn, was wicked in the  Lord ’s sight; so the  Lord  put him to death. "
"1129","Genesis","38","8","Then Judah said to Onan, “Sleep with your brother’s wife and fulfill your duty to her as a brother-in-law to raise up offspring for your brother.”  "
"1130","Genesis","38","9","But Onan knew that the child would not be his; so whenever he slept with his brother’s wife, he spilled his semen on the ground to keep from providing offspring for his brother.  "
"1131","Genesis","38","10","What he did was wicked in the  Lord ’s sight; so the  Lord  put him to death also. "
"1132","Genesis","38","11","Judah then said to his daughter-in-law Tamar, “Live as a widow in your father’s household until my son Shelah grows up.” For he thought, “He may die too, just like his brothers.” So Tamar went to live in her father’s household. "
"1133","Genesis","38","12","After a long time Judah’s wife, the daughter of Shua, died. When Judah had recovered from his grief, he went up to Timnah, to the men who were shearing his sheep, and his friend Hirah the Adullamite went with him. "
"1134","Genesis","38","13","When Tamar was told, “Your father-in-law is on his way to Timnah to shear his sheep,”  "
"1135","Genesis","38","14","she took off her widow’s clothes, covered herself with a veil to disguise herself, and then sat down at the entrance to Enaim, which is on the road to Timnah. For she saw that, though Shelah had now grown up, she had not been given to him as his wife. "
"1136","Genesis","38","15","When Judah saw her, he thought she was a prostitute, for she had covered her face.  "
"1137","Genesis","38","16","Not realizing that she was his daughter-in-law, he went over to her by the roadside and said, “Come now, let me sleep with you.” “And what will you give me to sleep with you?” she asked. "
"1138","Genesis","38","17","“I’ll send you a young goat from my flock,” he said. “Will you give me something as a pledge until you send it?” she asked. "
"1139","Genesis","38","18","He said, “What pledge should I give you?” “Your seal and its cord, and the staff in your hand,” she answered. So he gave them to her and slept with her, and she became pregnant by him.  "
"1140","Genesis","38","19","After she left, she took off her veil and put on her widow’s clothes again. "
"1141","Genesis","38","20","Meanwhile Judah sent the young goat by his friend the Adullamite in order to get his pledge back from the woman, but he did not find her.  "
"1142","Genesis","38","21","He asked the men who lived there, “Where is the shrine prostitute who was beside the road at Enaim?” “There hasn’t been any shrine prostitute here,” they said. "
"1143","Genesis","38","22","So he went back to Judah and said, “I didn’t find her. Besides, the men who lived there said, ‘There hasn’t been any shrine prostitute here.’ ” "
"1144","Genesis","38","23","Then Judah said, “Let her keep what she has, or we will become a laughingstock. After all, I did send her this young goat, but you didn’t find her.” "
"1145","Genesis","38","24","About three months later Judah was told, “Your daughter-in-law Tamar is guilty of prostitution, and as a result she is now pregnant.” Judah said, “Bring her out and have her burned to death!” "
"1146","Genesis","38","25","As she was being brought out, she sent a message to her father-in-law. “I am pregnant by the man who owns these,” she said. And she added, “See if you recognize whose seal and cord and staff these are.” "
"1147","Genesis","38","26","Judah recognized them and said, “She is more righteous than I, since I wouldn’t give her to my son Shelah.” And he did not sleep with her again. "
"1148","Genesis","38","27","When the time came for her to give birth, there were twin boys in her womb.  "
"1149","Genesis","38","28","As she was giving birth, one of them put out his hand; so the midwife took a scarlet thread and tied it on his wrist and said, “This one came out first.”  "
"1150","Genesis","38","29","But when he drew back his hand, his brother came out, and she said, “So this is how you have broken out!” And he was named Perez.   "
"1151","Genesis","38","30","Then his brother, who had the scarlet thread on his wrist, came out. And he was named Zerah."
"1152","Genesis","39","1","Now Joseph had been taken down to Egypt. Potiphar, an Egyptian who was one of Pharaoh’s officials, the captain of the guard, bought him from the Ishmaelites who had taken him there. "
"1153","Genesis","39","2","The  Lord  was with Joseph so that he prospered, and he lived in the house of his Egyptian master.  "
"1154","Genesis","39","3","When his master saw that the  Lord  was with him and that the  Lord  gave him success in everything he did,  "
"1155","Genesis","39","4","Joseph found favor in his eyes and became his attendant. Potiphar put him in charge of his household, and he entrusted to his care everything he owned.  "
"1156","Genesis","39","5","From the time he put him in charge of his household and of all that he owned, the  Lord  blessed the household of the Egyptian because of Joseph. The blessing of the  Lord  was on everything Potiphar had, both in the house and in the field.  "
"1157","Genesis","39","6","So Potiphar left everything he had in Joseph’s care; with Joseph in charge, he did not concern himself with anything except the food he ate. Now Joseph was well-built and handsome,  "
"1158","Genesis","39","7","and after a while his master’s wife took notice of Joseph and said, “Come to bed with me!” "
"1159","Genesis","39","8","But he refused. “With me in charge,” he told her, “my master does not concern himself with anything in the house; everything he owns he has entrusted to my care.  "
"1160","Genesis","39","9","No one is greater in this house than I am. My master has withheld nothing from me except you, because you are his wife. How then could I do such a wicked thing and sin against God?”  "
"1161","Genesis","39","10","And though she spoke to Joseph day after day, he refused to go to bed with her or even be with her. "
"1162","Genesis","39","11","One day he went into the house to attend to his duties, and none of the household servants was inside.  "
"1163","Genesis","39","12","She caught him by his cloak and said, “Come to bed with me!” But he left his cloak in her hand and ran out of the house. "
"1164","Genesis","39","13","When she saw that he had left his cloak in her hand and had run out of the house,  "
"1165","Genesis","39","14","she called her household servants. “Look,” she said to them, “this Hebrew has been brought to us to make sport of us! He came in here to sleep with me, but I screamed.  "
"1166","Genesis","39","15","When he heard me scream for help, he left his cloak beside me and ran out of the house.” "
"1167","Genesis","39","16","She kept his cloak beside her until his master came home.  "
"1168","Genesis","39","17","Then she told him this story: “That Hebrew slave you brought us came to me to make sport of me.  "
"1169","Genesis","39","18","But as soon as I screamed for help, he left his cloak beside me and ran out of the house.” "
"1170","Genesis","39","19","When his master heard the story his wife told him, saying, “This is how your slave treated me,” he burned with anger.  "
"1171","Genesis","39","20","Joseph’s master took him and put him in prison, the place where the king’s prisoners were confined. But while Joseph was there in the prison,  "
"1172","Genesis","39","21","the  Lord  was with him; he showed him kindness and granted him favor in the eyes of the prison warden.  "
"1173","Genesis","39","22","So the warden put Joseph in charge of all those held in the prison, and he was made responsible for all that was done there.  "
"1174","Genesis","39","23","The warden paid no attention to anything under Joseph’s care, because the  Lord  was with Joseph and gave him success in whatever he did."
"1175","Genesis","40","1","Some time later, the cupbearer and the baker of the king of Egypt offended their master, the king of Egypt.  "
"1176","Genesis","40","2","Pharaoh was angry with his two officials, the chief cupbearer and the chief baker,  "
"1177","Genesis","40","3","and put them in custody in the house of the captain of the guard, in the same prison where Joseph was confined.  "
"1178","Genesis","40","4","The captain of the guard assigned them to Joseph, and he attended them. After they had been in custody for some time,  "
"1179","Genesis","40","5","each of the two men—the cupbearer and the baker of the king of Egypt, who were being held in prison—had a dream the same night, and each dream had a meaning of its own. "
"1180","Genesis","40","6","When Joseph came to them the next morning, he saw that they were dejected.  "
"1181","Genesis","40","7","So he asked Pharaoh’s officials who were in custody with him in his master’s house, “Why do you look so sad today?” "
"1182","Genesis","40","8","“We both had dreams,” they answered, “but there is no one to interpret them.” Then Joseph said to them, “Do not interpretations belong to God? Tell me your dreams.” "
"1183","Genesis","40","9","So the chief cupbearer told Joseph his dream. He said to him, “In my dream I saw a vine in front of me,  "
"1184","Genesis","40","10","and on the vine were three branches. As soon as it budded, it blossomed, and its clusters ripened into grapes.  "
"1185","Genesis","40","11","Pharaoh’s cup was in my hand, and I took the grapes, squeezed them into Pharaoh’s cup and put the cup in his hand.” "
"1186","Genesis","40","12","“This is what it means,” Joseph said to him. “The three branches are three days.  "
"1187","Genesis","40","13","Within three days Pharaoh will lift up your head and restore you to your position, and you will put Pharaoh’s cup in his hand, just as you used to do when you were his cupbearer.  "
"1188","Genesis","40","14","But when all goes well with you, remember me and show me kindness; mention me to Pharaoh and get me out of this prison.  "
"1189","Genesis","40","15","I was forcibly carried off from the land of the Hebrews, and even here I have done nothing to deserve being put in a dungeon.” "
"1190","Genesis","40","16","When the chief baker saw that Joseph had given a favorable interpretation, he said to Joseph, “I too had a dream: On my head were three baskets of bread.   "
"1191","Genesis","40","17","In the top basket were all kinds of baked goods for Pharaoh, but the birds were eating them out of the basket on my head.” "
"1192","Genesis","40","18","“This is what it means,” Joseph said. “The three baskets are three days.  "
"1193","Genesis","40","19","Within three days Pharaoh will lift off your head and impale your body on a pole. And the birds will eat away your flesh.” "
"1194","Genesis","40","20","Now the third day was Pharaoh’s birthday, and he gave a feast for all his officials. He lifted up the heads of the chief cupbearer and the chief baker in the presence of his officials:  "
"1195","Genesis","40","21","He restored the chief cupbearer to his position, so that he once again put the cup into Pharaoh’s hand—  "
"1196","Genesis","40","22","but he impaled the chief baker, just as Joseph had said to them in his interpretation. "
"1197","Genesis","40","23","The chief cupbearer, however, did not remember Joseph; he forgot him."
"1198","Genesis","41","1","When two full years had passed, Pharaoh had a dream: He was standing by the Nile,  "
"1199","Genesis","41","2","when out of the river there came up seven cows, sleek and fat, and they grazed among the reeds.  "
"1200","Genesis","41","3","After them, seven other cows, ugly and gaunt, came up out of the Nile and stood beside those on the riverbank.  "
"1201","Genesis","41","4","And the cows that were ugly and gaunt ate up the seven sleek, fat cows. Then Pharaoh woke up. "
"1202","Genesis","41","5","He fell asleep again and had a second dream: Seven heads of grain, healthy and good, were growing on a single stalk.  "
"1203","Genesis","41","6","After them, seven other heads of grain sprouted—thin and scorched by the east wind.  "
"1204","Genesis","41","7","The thin heads of grain swallowed up the seven healthy, full heads. Then Pharaoh woke up; it had been a dream. "
"1205","Genesis","41","8","In the morning his mind was troubled, so he sent for all the magicians and wise men of Egypt. Pharaoh told them his dreams, but no one could interpret them for him. "
"1206","Genesis","41","9","Then the chief cupbearer said to Pharaoh, “Today I am reminded of my shortcomings.  "
"1207","Genesis","41","10","Pharaoh was once angry with his servants, and he imprisoned me and the chief baker in the house of the captain of the guard.  "
"1208","Genesis","41","11","Each of us had a dream the same night, and each dream had a meaning of its own.  "
"1209","Genesis","41","12","Now a young Hebrew was there with us, a servant of the captain of the guard. We told him our dreams, and he interpreted them for us, giving each man the interpretation of his dream.  "
"1210","Genesis","41","13","And things turned out exactly as he interpreted them to us: I was restored to my position, and the other man was impaled.” "
"1211","Genesis","41","14","So Pharaoh sent for Joseph, and he was quickly brought from the dungeon. When he had shaved and changed his clothes, he came before Pharaoh. "
"1212","Genesis","41","15","Pharaoh said to Joseph, “I had a dream, and no one can interpret it. But I have heard it said of you that when you hear a dream you can interpret it.” "
