"","book","chapter","verse","text"
"1710","Exodus","7","23","Instead, he turned and went into his palace, and did not take even this to heart.  "
"1711","Exodus","7","24","And all the Egyptians dug along the Nile to get drinking water, because they could not drink the water of the river. "
"1712","Exodus","7","25","Seven days passed after the  Lord  struck the Nile."
"1713","Exodus","8","  ",NA
"1714","Exodus","8","1","Then the  Lord  said to Moses, “Go to Pharaoh and say to him, ‘This is what the  Lord  says: Let my people go, so that they may worship me.  "
"1715","Exodus","8","2","If you refuse to let them go, I will send a plague of frogs on your whole country.  "
"1716","Exodus","8","3","The Nile will teem with frogs. They will come up into your palace and your bedroom and onto your bed, into the houses of your officials and on your people, and into your ovens and kneading troughs.  "
"1717","Exodus","8","4","The frogs will come up on you and your people and all your officials.’ ” "
"1718","Exodus","8","5","Then the  Lord  said to Moses, “Tell Aaron, ‘Stretch out your hand with your staff over the streams and canals and ponds, and make frogs come up on the land of Egypt.’ ” "
"1719","Exodus","8","6","So Aaron stretched out his hand over the waters of Egypt, and the frogs came up and covered the land.  "
"1720","Exodus","8","7","But the magicians did the same things by their secret arts; they also made frogs come up on the land of Egypt. "
"1721","Exodus","8","8","Pharaoh summoned Moses and Aaron and said, “Pray to the  Lord  to take the frogs away from me and my people, and I will let your people go to offer sacrifices to the  Lord .” "
"1722","Exodus","8","9","Moses said to Pharaoh, “I leave to you the honor of setting the time for me to pray for you and your officials and your people that you and your houses may be rid of the frogs, except for those that remain in the Nile.” "
"1723","Exodus","8","10","“Tomorrow,” Pharaoh said. Moses replied, “It will be as you say, so that you may know there is no one like the  Lord  our God.  "
"1724","Exodus","8","11","The frogs will leave you and your houses, your officials and your people; they will remain only in the Nile.” "
"1725","Exodus","8","12","After Moses and Aaron left Pharaoh, Moses cried out to the  Lord  about the frogs he had brought on Pharaoh.  "
"1726","Exodus","8","13","And the  Lord  did what Moses asked. The frogs died in the houses, in the courtyards and in the fields.  "
"1727","Exodus","8","14","They were piled into heaps, and the land reeked of them.  "
"1728","Exodus","8","15","But when Pharaoh saw that there was relief, he hardened his heart and would not listen to Moses and Aaron, just as the  Lord  had said. "
"1729","Exodus","8","16","Then the  Lord  said to Moses, “Tell Aaron, ‘Stretch out your staff and strike the dust of the ground,’ and throughout the land of Egypt the dust will become gnats.”  "
"1730","Exodus","8","17","They did this, and when Aaron stretched out his hand with the staff and struck the dust of the ground, gnats came on people and animals. All the dust throughout the land of Egypt became gnats.  "
"1731","Exodus","8","18","But when the magicians tried to produce gnats by their secret arts, they could not. Since the gnats were on people and animals everywhere,  "
"1732","Exodus","8","19","the magicians said to Pharaoh, “This is the finger of God.” But Pharaoh’s heart was hard and he would not listen, just as the  Lord  had said. "
"1733","Exodus","8","20","Then the  Lord  said to Moses, “Get up early in the morning and confront Pharaoh as he goes to the river and say to him, ‘This is what the  Lord  says: Let my people go, so that they may worship me.  "
"1734","Exodus","8","21","If you do not let my people go, I will send swarms of flies on you and your officials, on your people and into your houses. The houses of the Egyptians will be full of flies; even the ground will be covered with them. "
"1735","Exodus","8","22","“ ‘But on that day I will deal differently with the land of Goshen, where my people live; no swarms of flies will be there, so that you will know that I, the  Lord , am in this land.  "
"1736","Exodus","8","23","I will make a distinction  between my people and your people. This sign will occur tomorrow.’ ” "
"1737","Exodus","8","24","And the  Lord  did this. Dense swarms of flies poured into Pharaoh’s palace and into the houses of his officials; throughout Egypt the land was ruined by the flies. "
"1738","Exodus","8","25","Then Pharaoh summoned Moses and Aaron and said, “Go, sacrifice to your God here in the land.” "
"1739","Exodus","8","26","But Moses said, “That would not be right. The sacrifices we offer the  Lord  our God would be detestable to the Egyptians. And if we offer sacrifices that are detestable in their eyes, will they not stone us?  "
"1740","Exodus","8","27","We must take a three-day journey into the wilderness to offer sacrifices to the  Lord  our God, as he commands us.” "
"1741","Exodus","8","28","Pharaoh said, “I will let you go to offer sacrifices to the  Lord  your God in the wilderness, but you must not go very far. Now pray for me.” "
"1742","Exodus","8","29","Moses answered, “As soon as I leave you, I will pray to the  Lord , and tomorrow the flies will leave Pharaoh and his officials and his people. Only let Pharaoh be sure that he does not act deceitfully again by not letting the people go to offer sacrifices to the  Lord .” "
"1743","Exodus","8","30","Then Moses left Pharaoh and prayed to the  Lord ,  "
"1744","Exodus","8","31","and the  Lord  did what Moses asked. The flies left Pharaoh and his officials and his people; not a fly remained.  "
"1745","Exodus","8","32","But this time also Pharaoh hardened his heart and would not let the people go."
"1746","Exodus","9","1","Then the  Lord  said to Moses, “Go to Pharaoh and say to him, ‘This is what the  Lord , the God of the Hebrews, says: “Let my people go, so that they may worship me.”  "
"1747","Exodus","9","2","If you refuse to let them go and continue to hold them back,  "
"1748","Exodus","9","3","the hand of the  Lord  will bring a terrible plague on your livestock in the field—on your horses, donkeys and camels and on your cattle, sheep and goats.  "
"1749","Exodus","9","4","But the  Lord  will make a distinction between the livestock of Israel and that of Egypt, so that no animal belonging to the Israelites will die.’ ” "
"1750","Exodus","9","5","The  Lord  set a time and said, “Tomorrow the  Lord  will do this in the land.”  "
"1751","Exodus","9","6","And the next day the  Lord  did it: All the livestock of the Egyptians died, but not one animal belonging to the Israelites died.  "
"1752","Exodus","9","7","Pharaoh investigated and found that not even one of the animals of the Israelites had died. Yet his heart was unyielding and he would not let the people go. "
"1753","Exodus","9","8","Then the  Lord  said to Moses and Aaron, “Take handfuls of soot from a furnace and have Moses toss it into the air in the presence of Pharaoh.  "
"1754","Exodus","9","9","It will become fine dust over the whole land of Egypt, and festering boils will break out on people and animals throughout the land.” "
"1755","Exodus","9","10","So they took soot from a furnace and stood before Pharaoh. Moses tossed it into the air, and festering boils broke out on people and animals.  "
"1756","Exodus","9","11","The magicians could not stand before Moses because of the boils that were on them and on all the Egyptians.  "
"1757","Exodus","9","12","But the  Lord  hardened Pharaoh’s heart and he would not listen to Moses and Aaron, just as the  Lord  had said to Moses. "
"1758","Exodus","9","13","Then the  Lord  said to Moses, “Get up early in the morning, confront Pharaoh and say to him, ‘This is what the  Lord , the God of the Hebrews, says: Let my people go, so that they may worship me,  "
"1759","Exodus","9","14","or this time I will send the full force of my plagues against you and against your officials and your people, so you may know that there is no one like me in all the earth.  "
"1760","Exodus","9","15","For by now I could have stretched out my hand and struck you and your people with a plague that would have wiped you off the earth.  "
"1761","Exodus","9","16","But I have raised you up  for this very purpose, that I might show you my power and that my name might be proclaimed in all the earth.  "
"1762","Exodus","9","17","You still set yourself against my people and will not let them go.  "
"1763","Exodus","9","18","Therefore, at this time tomorrow I will send the worst hailstorm that has ever fallen on Egypt, from the day it was founded till now.  "
"1764","Exodus","9","19","Give an order now to bring your livestock and everything you have in the field to a place of shelter, because the hail will fall on every person and animal that has not been brought in and is still out in the field, and they will die.’ ” "
"1765","Exodus","9","20","Those officials of Pharaoh who feared the word of the  Lord  hurried to bring their slaves and their livestock inside.  "
"1766","Exodus","9","21","But those who ignored the word of the  Lord  left their slaves and livestock in the field. "
"1767","Exodus","9","22","Then the  Lord  said to Moses, “Stretch out your hand toward the sky so that hail will fall all over Egypt—on people and animals and on everything growing in the fields of Egypt.”  "
"1768","Exodus","9","23","When Moses stretched out his staff toward the sky, the  Lord  sent thunder and hail, and lightning flashed down to the ground. So the  Lord  rained hail on the land of Egypt;  "
"1769","Exodus","9","24","hail fell and lightning flashed back and forth. It was the worst storm in all the land of Egypt since it had become a nation.  "
"1770","Exodus","9","25","Throughout Egypt hail struck everything in the fields—both people and animals; it beat down everything growing in the fields and stripped every tree.  "
"1771","Exodus","9","26","The only place it did not hail was the land of Goshen, where the Israelites were. "
"1772","Exodus","9","27","Then Pharaoh summoned Moses and Aaron. “This time I have sinned,” he said to them. “The  Lord  is in the right, and I and my people are in the wrong.  "
"1773","Exodus","9","28","Pray to the  Lord , for we have had enough thunder and hail. I will let you go; you don’t have to stay any longer.” "
"1774","Exodus","9","29","Moses replied, “When I have gone out of the city, I will spread out my hands in prayer to the  Lord . The thunder will stop and there will be no more hail, so you may know that the earth is the  Lord ’s.  "
"1775","Exodus","9","30","But I know that you and your officials still do not fear the  Lord  God.” "
"1776","Exodus","9","31","(The flax and barley were destroyed, since the barley had headed and the flax was in bloom.  "
"1777","Exodus","9","32","The wheat and spelt, however, were not destroyed, because they ripen later.) "
"1778","Exodus","9","33","Then Moses left Pharaoh and went out of the city. He spread out his hands toward the  Lord ; the thunder and hail stopped, and the rain no longer poured down on the land.  "
"1779","Exodus","9","34","When Pharaoh saw that the rain and hail and thunder had stopped, he sinned again: He and his officials hardened their hearts.  "
"1780","Exodus","9","35","So Pharaoh’s heart was hard and he would not let the Israelites go, just as the  Lord  had said through Moses."
"1781","Exodus","10","1","Then the  Lord  said to Moses, “Go to Pharaoh, for I have hardened his heart and the hearts of his officials so that I may perform these signs of mine among them  "
"1782","Exodus","10","2","that you may tell your children and grandchildren how I dealt harshly with the Egyptians and how I performed my signs among them, and that you may know that I am the  Lord .” "
"1783","Exodus","10","3","So Moses and Aaron went to Pharaoh and said to him, “This is what the  Lord , the God of the Hebrews, says: ‘How long will you refuse to humble yourself before me? Let my people go, so that they may worship me.  "
"1784","Exodus","10","4","If you refuse to let them go, I will bring locusts into your country tomorrow.  "
"1785","Exodus","10","5","They will cover the face of the ground so that it cannot be seen. They will devour what little you have left after the hail, including every tree that is growing in your fields.  "
"1786","Exodus","10","6","They will fill your houses and those of all your officials and all the Egyptians—something neither your parents nor your ancestors have ever seen from the day they settled in this land till now.’ ” Then Moses turned and left Pharaoh. "
"1787","Exodus","10","7","Pharaoh’s officials said to him, “How long will this man be a snare to us? Let the people go, so that they may worship the  Lord  their God. Do you not yet realize that Egypt is ruined?” "
"1788","Exodus","10","8","Then Moses and Aaron were brought back to Pharaoh. “Go, worship the  Lord  your God,” he said. “But tell me who will be going.” "
"1789","Exodus","10","9","Moses answered, “We will go with our young and our old, with our sons and our daughters, and with our flocks and herds, because we are to celebrate a festival to the  Lord .” "
"1790","Exodus","10","10","Pharaoh said, “The  Lord  be with you—if I let you go, along with your women and children! Clearly you are bent on evil.   "
"1791","Exodus","10","11","No! Have only the men go and worship the  Lord , since that’s what you have been asking for.” Then Moses and Aaron were driven out of Pharaoh’s presence. "
"1792","Exodus","10","12","And the  Lord  said to Moses, “Stretch out your hand over Egypt so that locusts swarm over the land and devour everything growing in the fields, everything left by the hail.” "
"1793","Exodus","10","13","So Moses stretched out his staff over Egypt, and the  Lord  made an east wind blow across the land all that day and all that night. By morning the wind had brought the locusts;  "
"1794","Exodus","10","14","they invaded all Egypt and settled down in every area of the country in great numbers. Never before had there been such a plague of locusts, nor will there ever be again.  "
"1795","Exodus","10","15","They covered all the ground until it was black. They devoured all that was left after the hail—everything growing in the fields and the fruit on the trees. Nothing green remained on tree or plant in all the land of Egypt. "
"1796","Exodus","10","16","Pharaoh quickly summoned Moses and Aaron and said, “I have sinned against the  Lord  your God and against you.  "
"1797","Exodus","10","17","Now forgive my sin once more and pray to the  Lord  your God to take this deadly plague away from me.” "
"1798","Exodus","10","18","Moses then left Pharaoh and prayed to the  Lord .  "
"1799","Exodus","10","19","And the  Lord  changed the wind to a very strong west wind, which caught up the locusts and carried them into the Red Sea.  Not a locust was left anywhere in Egypt.  "
"1800","Exodus","10","20","But the  Lord  hardened Pharaoh’s heart, and he would not let the Israelites go. "
"1801","Exodus","10","21","Then the  Lord  said to Moses, “Stretch out your hand toward the sky so that darkness spreads over Egypt—darkness that can be felt.”  "
"1802","Exodus","10","22","So Moses stretched out his hand toward the sky, and total darkness covered all Egypt for three days.  "
"1803","Exodus","10","23","No one could see anyone else or move about for three days. Yet all the Israelites had light in the places where they lived. "
"1804","Exodus","10","24","Then Pharaoh summoned Moses and said, “Go, worship the  Lord . Even your women and children may go with you; only leave your flocks and herds behind.” "
"1805","Exodus","10","25","But Moses said, “You must allow us to have sacrifices and burnt offerings to present to the  Lord  our God.  "
"1806","Exodus","10","26","Our livestock too must go with us; not a hoof is to be left behind. We have to use some of them in worshiping the  Lord  our God, and until we get there we will not know what we are to use to worship the  Lord .” "
"1807","Exodus","10","27","But the  Lord  hardened Pharaoh’s heart, and he was not willing to let them go.  "
"1808","Exodus","10","28","Pharaoh said to Moses, “Get out of my sight! Make sure you do not appear before me again! The day you see my face you will die.” "
"1809","Exodus","10","29","“Just as you say,” Moses replied. “I will never appear before you again.”"
"1810","Exodus","11","1","Now the  Lord  had said to Moses, “I will bring one more plague on Pharaoh and on Egypt. After that, he will let you go from here, and when he does, he will drive you out completely.  "
"1811","Exodus","11","2","Tell the people that men and women alike are to ask their neighbors for articles of silver and gold.”  "
"1812","Exodus","11","3","(The  Lord  made the Egyptians favorably disposed toward the people, and Moses himself was highly regarded in Egypt by Pharaoh’s officials and by the people.) "
"1813","Exodus","11","4","So Moses said, “This is what the  Lord  says: ‘About midnight I will go throughout Egypt.  "
"1814","Exodus","11","5","Every firstborn son in Egypt will die, from the firstborn son of Pharaoh, who sits on the throne, to the firstborn son of the female slave, who is at her hand mill, and all the firstborn of the cattle as well.  "
"1815","Exodus","11","6","There will be loud wailing throughout Egypt—worse than there has ever been or ever will be again.  "
"1816","Exodus","11","7","But among the Israelites not a dog will bark at any person or animal.’ Then you will know that the  Lord  makes a distinction between Egypt and Israel.  "
"1817","Exodus","11","8","All these officials of yours will come to me, bowing down before me and saying, ‘Go, you and all the people who follow you!’ After that I will leave.” Then Moses, hot with anger, left Pharaoh. "
"1818","Exodus","11","9","The  Lord  had said to Moses, “Pharaoh will refuse to listen to you—so that my wonders may be multiplied in Egypt.”  "
"1819","Exodus","11","10","Moses and Aaron performed all these wonders before Pharaoh, but the  Lord  hardened Pharaoh’s heart, and he would not let the Israelites go out of his country."
"1820","Exodus","12","1","The  Lord  said to Moses and Aaron in Egypt,  "
"1821","Exodus","12","2","“This month is to be for you the first month, the first month of your year.  "
"1822","Exodus","12","3","Tell the whole community of Israel that on the tenth day of this month each man is to take a lamb  for his family, one for each household.  "
"1823","Exodus","12","4","If any household is too small for a whole lamb, they must share one with their nearest neighbor, having taken into account the number of people there are. You are to determine the amount of lamb needed in accordance with what each person will eat.  "
"1824","Exodus","12","5","The animals you choose must be year-old males without defect, and you may take them from the sheep or the goats.  "
"1825","Exodus","12","6","Take care of them until the fourteenth day of the month, when all the members of the community of Israel must slaughter them at twilight.  "
"1826","Exodus","12","7","Then they are to take some of the blood and put it on the sides and tops of the doorframes of the houses where they eat the lambs.  "
"1827","Exodus","12","8","That same night they are to eat the meat roasted over the fire, along with bitter herbs, and bread made without yeast.  "
"1828","Exodus","12","9","Do not eat the meat raw or boiled in water, but roast it over a fire—with the head, legs and internal organs.  "
"1829","Exodus","12","10","Do not leave any of it till morning; if some is left till morning, you must burn it.  "
"1830","Exodus","12","11","This is how you are to eat it: with your cloak tucked into your belt, your sandals on your feet and your staff in your hand. Eat it in haste; it is the  Lord ’s Passover. "
"1831","Exodus","12","12","“On that same night I will pass through Egypt and strike down every firstborn of both people and animals, and I will bring judgment on all the gods of Egypt. I am the  Lord .  "
"1832","Exodus","12","13","The blood will be a sign for you on the houses where you are, and when I see the blood, I will pass over you. No destructive plague will touch you when I strike Egypt. "
"1833","Exodus","12","14","“This is a day you are to commemorate; for the generations to come you shall celebrate it as a festival to the  Lord —a lasting ordinance.  "
"1834","Exodus","12","15","For seven days you are to eat bread made without yeast. On the first day remove the yeast from your houses, for whoever eats anything with yeast in it from the first day through the seventh must be cut off from Israel.  "
"1835","Exodus","12","16","On the first day hold a sacred assembly, and another one on the seventh day. Do no work at all on these days, except to prepare food for everyone to eat; that is all you may do. "
"1836","Exodus","12","17","“Celebrate the Festival of Unleavened Bread, because it was on this very day that I brought your divisions out of Egypt. Celebrate this day as a lasting ordinance for the generations to come.  "
"1837","Exodus","12","18","In the first month you are to eat bread made without yeast, from the evening of the fourteenth day until the evening of the twenty-first day.  "
"1838","Exodus","12","19","For seven days no yeast is to be found in your houses. And anyone, whether foreigner or native-born, who eats anything with yeast in it must be cut off from the community of Israel.  "
"1839","Exodus","12","20","Eat nothing made with yeast. Wherever you live, you must eat unleavened bread.” "
"1840","Exodus","12","21","Then Moses summoned all the elders of Israel and said to them, “Go at once and select the animals for your families and slaughter the Passover lamb.  "
"1841","Exodus","12","22","Take a bunch of hyssop, dip it into the blood in the basin and put some of the blood on the top and on both sides of the doorframe. None of you shall go out of the door of your house until morning.  "
"1842","Exodus","12","23","When the  Lord  goes through the land to strike down the Egyptians, he will see the blood on the top and sides of the doorframe and will pass over that doorway, and he will not permit the destroyer to enter your houses and strike you down. "
"1843","Exodus","12","24","“Obey these instructions as a lasting ordinance for you and your descendants.  "
"1844","Exodus","12","25","When you enter the land that the  Lord  will give you as he promised, observe this ceremony.  "
"1845","Exodus","12","26","And when your children ask you, ‘What does this ceremony mean to you?’  "
"1846","Exodus","12","27","then tell them, ‘It is the Passover sacrifice to the  Lord , who passed over the houses of the Israelites in Egypt and spared our homes when he struck down the Egyptians.’ ” Then the people bowed down and worshiped.  "
"1847","Exodus","12","28","The Israelites did just what the  Lord  commanded Moses and Aaron. "
"1848","Exodus","12","29","At midnight the  Lord  struck down all the firstborn in Egypt, from the firstborn of Pharaoh, who sat on the throne, to the firstborn of the prisoner, who was in the dungeon, and the firstborn of all the livestock as well.  "
"1849","Exodus","12","30","Pharaoh and all his officials and all the Egyptians got up during the night, and there was loud wailing in Egypt, for there was not a house without someone dead. "
"1850","Exodus","12","31","During the night Pharaoh summoned Moses and Aaron and said, “Up! Leave my people, you and the Israelites! Go, worship the  Lord  as you have requested.  "
"1851","Exodus","12","32","Take your flocks and herds, as you have said, and go. And also bless me.” "
"1852","Exodus","12","33","The Egyptians urged the people to hurry and leave the country. “For otherwise,” they said, “we will all die!”  "
"1853","Exodus","12","34","So the people took their dough before the yeast was added, and carried it on their shoulders in kneading troughs wrapped in clothing.  "
"1854","Exodus","12","35","The Israelites did as Moses instructed and asked the Egyptians for articles of silver and gold and for clothing.  "
"1855","Exodus","12","36","The  Lord  had made the Egyptians favorably disposed toward the people, and they gave them what they asked for; so they plundered the Egyptians. "
"1856","Exodus","12","37","The Israelites journeyed from Rameses to Sukkoth. There were about six hundred thousand men on foot, besides women and children.  "
"1857","Exodus","12","38","Many other people went up with them, and also large droves of livestock, both flocks and herds.  "
"1858","Exodus","12","39","With the dough the Israelites had brought from Egypt, they baked loaves of unleavened bread. The dough was without yeast because they had been driven out of Egypt and did not have time to prepare food for themselves. "
"1859","Exodus","12","40","Now the length of time the Israelite people lived in Egypt  was 430 years.  "
"1860","Exodus","12","41","At the end of the 430 years, to the very day, all the  Lord ’s divisions left Egypt.  "
"1861","Exodus","12","42","Because the  Lord  kept vigil that night to bring them out of Egypt, on this night all the Israelites are to keep vigil to honor the  Lord  for the generations to come. "
"1862","Exodus","12","43","The  Lord  said to Moses and Aaron, “These are the regulations for the Passover meal: “No foreigner may eat it.  "
"1863","Exodus","12","44","Any slave you have bought may eat it after you have circumcised him,  "
"1864","Exodus","12","45","but a temporary resident or a hired worker may not eat it. "
